{
  "@context": [
    "https://www.w3.org/2018/credentials/v1",
    "https://www.w3.org/2018/credentials/examples/v1"
  ],
  "id": "http://example.edu/credentials/3732",
  "type": ["VerifiableCredential", "UniversityDegreeCredential"],
  "issuer": "https://example.edu/issuers/14",
  "validFrom": "2010-01-01T19:23:24Z",
  "credentialSubject": {
    "id": "did:example:ebfeb1f712ebc6f1c276e12ec21",
    "degree": {
      "type": "BachelorDegree",
      "name": "Bachelor of Science and Arts"
    }
  },
  "evidence": [{
    "id": "https://example.edu/evidence/f2aeec97-fc0d-42bf-8ca7-0548192d4231",
    "type": ["DocumentVerification"],
    "verifier": "https://example.edu/issuers/14",
    "evidenceDocument": "DriversLicense",
    "subjectPresence": "Physical",
    "documentPresence": "Physical",
    "licenseNumber": "123AB4567"
  }]
}