{
  "@context": [
    "https://www.w3.org/2018/credentials/v1",
    "https://www.w3.org/2018/credentials/examples/v1"
  ],
  "id": "http://example.edu/credentials/3732",
  "type": ["VerifiableCredential", "UniversityDegreeCredential"],
  "issuer": "https://example.edu/issuers/14",
  "validFrom": "2010-01-01T19:23:24Z",
  "credentialSubject": {
    "id": "did:example:ebfeb1f712ebc6f1c276e12ec21",
    "degree": {
      "type": "BachelorDegree",
      "name": "Bachelor of Science and Arts"
    }
  },
  "termsOfUse": [{
    "type": "IssuerPolicy",
    "id": "http://example.com/policies/credential/4",
    "profile": "http://example.com/profiles/credential",
    "prohibition": [{
      "assigner": "https://example.edu/issuers/14",
      "assignee": "AllVerifiers",
      "target": "http://example.edu/credentials/3732",
      "action": ["Archival"]
    }]
  }]
}