{
  "@context": [
    "https://www.w3.org/ns/credentials/v2",
    "https://www.w3.org/ns/credentials/examples/v2"
  ],
  "id": "http://example.edu/credentials/1872",
  "type": ["VerifiableCredential", "AlumniCredential"],
  "issuer": "https://example.edu/issuers/565049",
  "validFrom": "2010-01-01T19:23:24Z",
  "credentialSubject": {
    "id": "did:example:ebfeb1f712ebc6f1c276e12ec21",
    "alumniOf": {
      "id": "did:example:c276e12ec21ebfeb1f712ebc6f1",
      "name": [{
        "value": "Example University",
        "lang": "en"
      }, {
        "value": "Exemple d'Universit√©",
        "lang": "fr"
      }]
    }
  },
  "proof": {
    "type": "RsaSignature2018",
    "created": "2017-06-18T21:19:10Z",
    "proofPurpose": "assertionMethod",
    "verificationMethod": "https://example.edu/issuers/565049#key-1", 
    "jws": "eyJhbGciOiJSUzI1NiIsImI2NCI6ZmFsc2UsImNyaXQiOlsiYjY0Il19..TCYt5XsITJX1CxPCT8yAV-TVkIEq_PbChOMqsLfRoPsnsgw5WEuts01mq-pQy7UJiN5mgRxD-WUcX16dUEMGlv50aqzpqh4Qktb3rk-BuQy72IFLOqV0G_zS245-kronKb78cPN25DGlcTwLtjPAYuNzVBAh4vGHSrQyHUdBBPM"
  }
}