{
  "@context": [
    "https://www.w3.org/ns/credentials/v2",
    "https://www.w3.org/ns/credentials/examples/v2"
  ],
  "id": "http://example.gov/credentials/3732",
  "type": ["VerifiableCredential", "UniversityDegreeCredential"],
  "issuer": "https://example.edu",
  "validFrom": "2010-01-01T19:23:24Z",
  "credentialSubject": {
    "id": "did:example:ebfeb1f712ebc6f1c276e12ec21",
    "degree": {
      "type": "BachelorDegree",
      "name": "Bachelor of Science and Arts"
    }
  },
  "proof": {
    "type": "Ed25519Signature2020",
    "created": "2021-11-13T18:19:39Z",
    "verificationMethod": "https://example.edu/issuers/14#key-1",
    "proofPurpose": "assertionMethod",
    "proofValue": "z58DAdFfa9SkqZMVPxAQpic7ndSayn1PzZs6ZjWp1CktyGesjuTSwRdoWhAfGFCF5bppETSTojQCrfFPP2oumHKtz"
  }
}